{"certification_state":{"C1":"BLOCKED","C2":"BLOCKED","C3":"BLOCKED","C4":"FAIL","C4_completed":0,"C4_denominator":3378,"C5":"BLOCKED","C6":"BLOCKED","C7":"BLOCKED","final_state":"FAIL"},"checks":[{"check":"authority-separation","status":"PASS"},{"check":"closed-coordinate-state-algebra","status":"PASS"},{"check":"o1-through-o8-claim-boundaries","status":"PASS"},{"check":"deterministic-adjudication","status":"PASS"},{"check":"reason-code-totality","status":"PASS"},{"check":"missing-evidence-is-not-failure","status":"PASS"},{"check":"infrastructure-is-not-target-failure","status":"PASS"},{"check":"immutable-attempt-and-observation-lineage","status":"PASS"},{"check":"discrepancy-history-preservation","status":"PASS"},{"check":"permitted-divergence-positive-authority","status":"PASS"},{"check":"waiver-gate-only-effect","status":"PASS"},{"check":"quarantine-evidence-preservation","status":"PASS"},{"check":"expectation-revision-freeze","status":"PASS"},{"check":"claim-circularity-rejection","status":"PASS"},{"check":"inadmissible-evidence-exclusion","status":"PASS"},{"check":"denominator-unchanged","status":"PASS"},{"check":"certification-honesty","status":"PASS"},{"check":"production-boundary","status":"PASS"}],"claim_scope":"Acceptance of deterministic, synthetic-fixture-only observation-to-claim adjudication; no production profile coordinate, empirical execution, evidence credit, public compatibility projection, or repository-wide certification is created.","contract":{"artifact_id":"rcid:v1:trust-policy-revision:h:jcs-sha256-v1:bf4e8f41fc371911e99e1a54f76a9fe1718c32aed3d5c6cb3bbb261396aa7b97","digest_sha256":"f9abf697769c29045208d735e789f3c0963bb0548eb7ef849b7877ac10a7af2b","path":"adjudication/contracts/regex-conformance-adjudication-2026-09-11.v1.json"},"coverage":{"adversarial_case_count":17,"contract_claim_kind_count":15,"contract_coordinate_state_count":13,"coordinate_state_count":13,"discrepancy_classification_count":12,"discrepancy_relationship_count":8,"evidence_role_count":8,"expected_outcome_kind_count":7,"scientific_state_count":11,"valid_case_count":21,"waiver_type_count":4},"denominator_boundary":{"conditional_requirements":1972,"obligations":2390,"production_coverage_credit":0,"profile_expanded_denominator":null,"real_profile_coordinates_generated":0,"requirements":3378,"unconditional_requirements":1406},"fixtures":{"artifact_id":"rcid:v1:artifact-set-manifest:h:jcs-sha256-v1:7e226ac7a30ca3fbe6345109e3798cba98e46f9dfa293913bd696cb85e64c4a0","digest_sha256":"376077c391eba40891bef70acc05a0aef35079832e8b5811482bb0339e4eac6c","path":"tests/fixtures/adjudication/adjudication-cases.v1.json"},"implementation_bindings":[{"path":"schemas/tooling/python/regex_conformance_schema/adjudication.py","sha256":"7a1045cc722257efddbc33b3b52a81b231ce63a8d21d2a550d851e5415c3a5b3"},{"path":"tools/adjudication/compile_adjudication.py","sha256":"30e0a4d9bc0c4ec0367bda92f194bd652326bdbe4fe60cadad1d59887a2dc6db"},{"path":"tests/schema/test_adjudication.py","sha256":"2a265606cb7e28af90c5a24f90099285c4e1e7d0b083430f8b134371c60182bf"}],"published_on":"2026-09-11","report_digest_sha256":"d24fa765082f01cf2424392e5e44ce6abe161ee7c7ec9a11c975c7daa27e3df8","report_id":"rcid:v1:trust-assessment:h:jcs-sha256-v1:6327057d995efa49a430cb3ef02cd8e82df0fa663b52df10e4a92a2b83fd4bcf","result":"PASS","schema_version":"adjudication-report.v1"}
